{
  "task_id": "qa-harness.002.qa",
  "role": "qa",
  "worker_id": "/root/qa_harness_qa",
  "status": "completed",
  "summary": "Independent fresh-path QA passed all six checks and 65 unit tests; frozen source and archived evidence unchanged.",
  "artifacts": [
    {
      "name": "qa",
      "path": "orchestrator/artifacts/qa-harness-002/qa/result.json"
    }
  ],
  "notes": [
    "No default QA output path invoked. No game execution or playable-build result claimed."
  ]
}
