{
  "task_id": "qa-harness.002.implement",
  "role": "engineer",
  "worker_id": "/root/qa_harness_engineer",
  "status": "completed",
  "summary": "Implemented required-suite preflight discovery and fresh exclusive output directories.",
  "artifacts": [
    {
      "name": "implementation",
      "path": "orchestrator/artifacts/qa-harness-002/implementation/result.json"
    }
  ],
  "notes": [
    "Engineer reports4 targetedintegrationtests passing; independentreviewandQA follow. No canonical archivedoutput overwritten; runtime remains unexecuted."
  ]
}
