{
  "task_id": "qa-harness.002.review",
  "role": "reviewer",
  "worker_id": "/root/qa_harness_reviewer",
  "status": "completed",
  "summary": "Independent frozen-source review accepted with no open findings. No runtime claim.",
  "artifacts": [
    {
      "name": "review",
      "path": "orchestrator/artifacts/qa-harness-002/review/result.json"
    }
  ],
  "notes": [
    "Actual Python 3.12 empty discovery returned 5; no baseline false PASS claimed."
  ]
}
