{
  "task_id": "bootstrap.engine",
  "worker_id": "/root/orchestration_engineer",
  "role": "engineer",
  "status": "completed",
  "summary": "Implemented the durable stdlib orchestration core with atomic locked state, dependency-aware task claims, native dispatch packets, verified handoffs, bounded recovery, manifest-backed build/test evidence, disabled-by-default runtime PASS, aggregate phase gates, spoiler/path firewalling, trusted local subprocess execution, role prompts, ledgers, schemas, and gap linting.",
  "artifacts": [
    {
      "name": "engine",
      "path": "orchestrator/engine.py"
    }
  ],
  "notes": [
    "Core engine tests pass 18/18.",
    "Black-box CLI and primitive tests pass 11/11 after excluding orchestrator/state and orchestrator/artifacts from quality source fingerprints.",
    "Runtime playtest PASS remains intentionally disabled until a real target execution environment is configured."
  ]
}
